,text
3174,очень часто доставлять продукт который срок годность щаканчиваться num день
3175,долго очень
3176,предупредить отмена определённый продукт заказ
3177,выигрывать скорость доставка ждать заказ час вместо обещать num минута заказ отменный след оформить лента везти час цена ниже
3178,сбор заказ обращать внимание предмет испортить продукт вместо возврат деньга испортить продукт приносить замена продукт заказать покупатель
3179,довольно полезный приложение правда говорить акция постоянный пользователь
3180,
3181,скудный ассортимент число медицинский товар ваш главное преимущество быстрый доставка который занимать num час озон чрезмерно высокий стоимость маленький вес товар
3182,пидорас сука
3183,хватать возможность оценка товар видно отзыв другой покупатель служба поддержка неудовлетворительно работать хотеться широкий ассортимент
3184,привозить гнилой вскрыть поврежднный часто опаздывать пользоваться удобно несмотря опоздание выбор продукт удобный привоз продукт быстрый цена приемлемый частый скидка ограниченный количество символ
3185,
3186,супер очень долгий доставка вечно задержка какиеть хотеться уладить это
3187,нужно писать доставить num минута
3188,замечательнобольша выборн хватать полезный специя готовкинуть доставка быстрый
3189,сбер выкупилвсе стать плохоранний постоянно заказывать здесьсейчас крайне редко нужно чтоть точно испортиться вкус точно знаючасто привозить тухляк это очень бесить любимый продстать невкусна перейти век
3190,доставлять испортить просрочить продукт поэтому заказывать срочно чтоть нужно
3191,почемуть каталог цена один добавление корзина акционный товар цена увеличиваться причм скидка дело экспресс доставка особый цена указывать каталог это баг приложение починить
3192,цена дорогой магазин спасать акция больший заказ выгонея делать пятрочко магнит платный доставка часто хватать ассортимент многий продукт наличие качество скорость доставка целое вс устраивать
3193,принести заказать
3194,испортиться доставка задержка задержка долго заказывать попробовать плохо снова быть
3195,качество фрукт овощ частый средний стоимость высокий охоть ассортимент пример привести вкусс вилы
3196,дорого
3197,курьер укладываться num мина частый numnum минута ждать
3198,сервис хороший небольшой покупка чтоть забыть купить идти магазин выбор широкий дешёвый
3199,другой точка разнообразие товар точка шар покатить мало разнообразие оценка низкий точка
3200,последний время очень долгий доставка
3201,исключительный случай
3202,раширять ассортимент снижать цена улучшать качество сборка заказ
3203,проходить оплата отменить заказ бонус возвзращаться
3204,думать ранний простой определение минимальный сумма заказ num рубль удобно заказывать именно такой сумма
3205,вечно опаздывать курьерчасто докладывать заказ
3206,плохо думать
3207,часто доставка заказ занимать долгий num минута numnum очень удобно поддержка отвечать течение несколько час отсутствовать оперативность хотеться ассортимент широкий разнообразный
3208,долгий доставка
3209,время доставка соответствовать
3210,очень долго собирать заказ ждать num минута пока собрать огурчик молоко хлеб кола num позиция
3211,круто
3212,очень долго первый
3213,почему задерживать заказ
3214,качество продукт очень
3215,заказ стать доставляться очень долго
3216,помешать добавлять кинза
3217,очень долгий доставка
3218,прислать молоко который num день просрочиться
3219,компания серьзнать плевать хотеть покупатель
3220,сервис целое плохой один раз приходиться кричать курьер трубка тк понимать доставлятьчтый курьер отменять заказ наш ведомо аля понимать даставлять дословно передать
3221,молочка готовый продукция переодичёска просрочить
3222,нравиться минимальный сумма заказ
3223,последний время увеличиться время заказ
3224,отвратительный сервис
3225,самокат стать долгий другой доставка
3226,очень часто приезжать гнилой заплесневелый фрукт овощ
3227,очень неудобный каталог сложно перемещаться внутри категория продукт
3228,очень плохо работать приложение очень неудобный поиск маленький ассортимент найти нужно
3229,истечение num минута ожидание заказ звонить техподдержка отвечать заказ привезти течение час разочаровать сегодня очень очень плохо
3230,дорогой магазин скидка выходить дорогой удобно цена пусть быть дешёвый думать покупатель стать ещ
3231,цена завысить сравнение другой сервис доставка бывать долгий num минута приходиться ждать num
3232,класс
3233,очень испортиться доставка последний время приложение писаться курьер вотвота итог время проходить менее num минута
3234,курьер расторопный номер мочь дозвониться домофон брать молча отменять заказ хотя номер который позвонить
3235,хороший магазинный доставка постоянно проблема
3236,необходимость писать доставка занять num минута фактический время numnum минута
3237,слишком завысить минимальный стоимость заказ num рубль
3238,увеличить скорость доставка ввести промокод ожидание num минута
3239,долгий доставка долгий сборка
3240,удобно связь поддержка переходить тг тг помочь
3241,ранний доставлять действительно num минутсейчас
3242,заявлять доставка num минута час пройти момент заказ неизвестно вообще доставить
3243,самокат оооочень долгий доставка это склад находиться рядом заказ num упаковка подгузник доставка num минута приложение отметить num кто обманывать
3244,последний время качество доставка ужасный рассчитывать один время итог постоянно задерживаться ждать час ранний доставка num минута
3245,очень долгий доставка выдерживать указанный тайминг
3246,часть позиция num процент дорогой сетевой магазин продукция самокат основное невкусный часто очень высокий минимальный стоимость заказ продукт простой дешёвый купить сетевой магазин доставка
3247,доставка долгий num мина постоянно минимальный заказ ассортимент посредственный один давать промокод длительный ожидание доставка
3248,цена некоторый товар сильно завысить
3249,удобно
3250,немного лагучий приложение знать проблема мой телефон
3251,нужный кнопка оставить дверь курьер видеть яркокрасный
3252,качество поддержка компетентность курьер русский язык некоторый оставлять желать хороший также срок годность продукт сожаление сколько претензия изменение хороший сторона num год появиться
3253,хотеться снова получать скиснуть зелень хотеться здоровый продукт кокосовый молоко мякоть мука сахар ореховый мука разнообразие зелень например очень нравиться скорость доставка поддержка оператор
3254,изначально огромный плюс доставлять заказ numnum минута ждать numnum большой плюс ваш сторона сравнение другой доставка ассортимент широкий
3255,очень долго везти заказ курьер хамить цена доставка вырасти поэтому заказывать друг место
3256,заявить один время доставка факт другой каждый
3257,первый соблюдаться указанный время доставка статус курьер путь соответствовать действительность num минута вместо num минута заказ привозиться num приехать вместо num минута num минута
3258,последний время увеличиться время доставка сегодня доставить num минута хотя писать приложение доставка задерживаться столько минута неинтересный вместо num минута ждать непонятно сколько время
3259,очень часто заканчиваться огромный количество продукт первый необходимость некоторый позиция тип детский питание закончиться очень долго пополняться numnum неделя
3260,устраивать
3261,какой х num минутный доставка длиться полчаса дорога находиться постоянный задержка
3262,долго
3263,дороговатый сравнение обычный сетевой магазин
3264,удобно посмотреть находиться курьер везт заказ потеряться позвонить удобно связаться напрямую курьер
3265,канаета сильно пиво потянуть
3266,доставка стать дорогой подняться цена товар выпечка достаточно мало
3267,вечный опаздывание порой путать заказ
3268,доставка num час num минута соответствовать действительность
3269,курьер постоянно задерживаться первоначально классно акция хватать классно ужас постоянный задержка курьер смысл пользоваться самокатом яндекс доставка такой время заказывать
3270,курьер часто опаздывать доставка занимать num минута num num поддержка работать слово случай опоздание курьер некуда обратиться поддержка помогать приносить извинение делать
3271,слишком долго
3272,отвратительный отношение покупатель служба поддержка бесполезный позиционировать быстрый доставка вместо numnum минута доставка numnumчас мочь сделать это написать извинить это верх клиентоориентированность
3273,быстрый удобный доставка неплохой ассортимент продукт умирать приложение забирать себя нерв время хватать промокод новый пользователь пусть
3274,шпинат пропасть свежий мусорк
3275,указывать реальный остаток время показывать карта курьер
3276,довольный сервис ждать заказ час пока начать собирать время оформление numnum продукт спустя час раскупить соответственно какой черта максимально довольный сервис
3277,понятно почему приложение писать num минута num минута курьер вотвота минута num
3278,высокий цена последний время доставка numnum минута хотя склад находиться пеший доступность
3279,дом пора понимать писать num минута каждый укладываться срок честно писать сколько время занять сборка доставка
3280,очень дорого
3281,ужасный поддержка писать скрипт никакой информация нормальный конструктивный ответ
3282,долго доставлять
3283,указать доставить num минута выходить
3284,малый ассортимент нескромный цена готовый еда такой качество слишком оверпрайсв остальной около
3285,знатный обманщик позиционировать быстрый доставка итог ждть заказ num минута это повашему быстро ещ доставщик нужно искать выбегать встречать перепутать подъезд ваш услуга воспользоваться
3286,привозить несвежий продукт мятый продукт доставка очень долгий
3287,часто доставка num минута
3288,сделать поддержка приложение самокат телега увеличить ассортимент добавить акция numnum типо
3289,очень долгий доставка наш район
3290,очень работать доставка целое сервис неплохой также необходимый считать пополнить ассортимент энергетический напиток сахар спасибо
3291,постоянно задерживаться доставка курьер найти мочь приложение писать курьер num минута итог numnum минута проходить продукт привозить хороший жалоба срок свежий овощ фрукт замечательный постоянный опоздание
3292,очень быстрый доставка нужно срочновечно курьер ехать numnum минута ассортимент пополнить
3293,поддержка никакой устраивать срок годность продукт возможно вернуть заказывать желание
3294,заказ задержать раз
3295,время привозить продукт
3296,молодец быстрый доставка приезжать понимать велосипед это невозможно
3297,целое вс устраивать ранний доставка намного быстрый
3298,классно цена очень завысить
3299,num минута ждм доставка немыслимо дллго
3300,отлично ассортимент
3301,расширить ассортимент завезти круассан кукиса самокат карпаччо курица индейка физически немой нуждаться новый поставщик салат цезарь
3302,заказ часто приезжать вовремя поддержка никак реагировать хотеться точность лояльность
3303,очень долго собирать заказ
3304,продукт постоянно свежий срок ещ нормальный качество продукт оставлять желать хороший видно правильный хранение курьер читать комментарий постоянно писать звонить стучать дверь вс равно долбиться
3305,хватать разнообразие картофель фри
3306,постоянно неправильно указываться время вместо заявить num минута доставлять num минута
3307,очень плохо осень num год сервис доставка отвратительный очередной ожидание заказ num минута ждать последний заказ удалять приложение
3308,удобно чтоть намного дорогой магазин
3309,курьер неадекват
3310,хватать вегетарианский продукт безлактозный ассортимент этот категория скудный
3311,очень часто подводить доставка
3312,постоянно задерживаться курьер
3313,нормально заказ num р яндекс лавка конкурировать смочь сделать платный доставка
3314,курьер еда долго порой грубить качество товар это вообще фу
3315,лояльность клиент
3316,очень дорого малый порция
3317,удобный комфортный отслеживать курьер карта спасибо
3318,пятёрочка быстрый работать
3319,доставка бывать очень долго писать num минута ждть час часто поступать звонок самокат брать трубка слышать чей разговор задний фон
3320,вс отлично просто замечательный кроме цена ребята понимать бизнес дело накручивать num цена магазин который накрутить это немного хамский отношение ваш юзер num год пользоваться цена тот пора num
3321,доставка легко мяться продукт зелень лист салат томат класть самый дно сверху тяжёлый продукт часто бывать упаковка продукт нарушить последний привезти рваный упаковка чечевица который рассыпаться пакет
3322,ваш курьер приезжать вовремя
3323,круто
3324,num
3325,очень долгий доставка овощ привозить испортить
3326,
3327,поддержка стать работать плохой ранний ответ модетый занимать около num минута доставка стать долгий вчера доставить час поддержка вообще отвечать случиться бывать разный обстоятельство понимать ранний сервис
3328,цена сильно завысить акционный товар цена выше магазинный таки удобно
3329,вечный проблема ваш приложение постоянно правильно показывать время доставка стоить num минута ждть показывать минута
3330,минимальный ценник заказ слишком большой ранний нормально частый завесить цена очень дорого
3331,маленький ассортимент
3332,добавить ассортимент выпечка круассан шоколад убрать очень расстроить постоянно брать поиск продукт приложение очень удобный пёстрый сделать простой цена некоторый позиция очень гуманный нужно исправить
3333,курьер читать комментарий заказ цена выше обычный магазинахпятерочкаперекрёстка тд ассортимент небольшой
3334,часто качественный продукт долгий доставка ассортимент маленький разнообразный приветливый курьер
3335,постоянно доставка пятьсот тысяча рубль мочь часто заказывать такой сумма хотеться например один сидя карантин мочь позволить выходить улица часто заканчиваться ассортимент очень больший проблема
3336,курьер грамотный стучаться дверь уметь просить
3337,привезти размокнуть чиабатта
3338,плохой ассортимент
3339,цена скорость
3340,часто приносить пропасть продукт особенно кефир заказывать num раз подряд кефир каждый приносилипропать гнилой фрукт овощ выбор товар хотеться видеть грамм количество шт упаковка яблоко перец тд
3341,заказ определённый сумма убрать мочь ранний начать ходить магазин нога
3342,цена стать выше магазин сожаление
3343,нравиться заказывать готовый еда просто продукт сегодня заказать бургер салат цезарь просто выкинуть невкусно курица пропасть
3344,отвратиьельный функция отдавать заказ звонок мочь находиться время телефон работа изз курьер отдавать заказ другой коллега отменять уезжать изз мой коллега оставаться еда быть переходить яндекс
3345,крутой онлайн магазинчик цена таки дорогой радовать скидка хотяб
