,text
2022,доставка стать очень долгий пара ждать часполтор хотя заказывать быстрый супермаркет это раздражать отбивать желание пользоваться ваш услуга хотя начало радоваться возможность быстро получать продукт
2023,трэш жуть некоторый продукт приходиться терпеть
2024,доставка частый занимать указанный время num минута час
2025,основное прекрасно большой ассортимент
2026,плюс являться быстрый доставка качество доставка продукт отвратительный фрукт овощ гнилой испортиться следующий день холодильник доставка вс раскрыть плохо запаковать разбросать
2027,
2028,норма
2029,качество продукт страдать очень часто привозить испортить еда
2030,последний время доставляться испортить просрочить товар улучшить качество продукт растерять клиент
2031,фрукт овощ часто полумёртвый состояние приезжать
2032,раз заказ доставить обещать num мина максимум num мина это очень печально
2033,периодически случаться задержка заказ например сегодня заказ сей пора приехать
2034,ужаснобыть num бонус спасиборешить оплатить имисумма выходить numр итог numприйтись откладывать товар бонус равно списать
2035,случай доставка испортить готовый еда офис техподдержка обращение просто начислить стоимость продукт данный случай нужно исключить некачественный продукт покупатель начислять бонус большой качество компенсация
2036,дороговатый сравнение конкурент
2037,долгий доставка
2038,долго
2039,очень часто продукт несвежий испортить соблюдаться условие хранение это очень расстраивать сформироваться определнный категория продукт который самокат выбрать заказывать причина
2040,ждать продукт numnum час знать заказывать приложение никакой информация время заказ приходиться писать поддержка
2041,курьер предлагать завершить заказ доставить товар привозить плохой качество морковь лук плесень
2042,долгий доставка видно местоположение курьер
2043,дотягивать качество богатый ленивый ценник бедный ленивый небольшой ассортимент поесть нечего лёгкий столовка сходить порция микроскопический
2044,качество продукт бренд самокат оставлять желать хороший высокий цена продукт бренд ужасно качественный продукт сторонний бредовый скорость плюс абсолютно бесплатный доставка numр это приятно удобно думать курс качество
2045,разредиться телефон попытаться попасть подъезд
2046,раздел веганский безглютеновый еда скорее галочка продукт мало часто больший часть это кофечаять остальной неплохо
2047,продукт приезжать очень хороший качество плохой срок годность твёрдый авокадо забывать класть продукт приходиться связываться поддержка который долго отвечать бывать доставлять полтора час пиздец вообще
2048,нравиться самокат свой ассортимент найдть обычный магазин хороший цена нравиться часто заказать определнный сумма доставка стать часто опаздывать
2049,удобно цена очень сильно меняться например сегодня мочь купить печение num рубль завтра раз дорогой
2050,вс отлично хотеться свежий продукт
2051,исключение товар список необходимо производить согласие клиент заказывать именно товар который итог наличие связаться предложить замена сервис доработать сегодня очень разочароваться заказ
2052,вс нормально
2053,рада расширение ассортимент категория натуральный продукт заморозить чай домашний заморозить полуфабрикат
2054,часто доставлять время привозить полностью заказ заказать
2055,ужас начать здравие закончить упака
2056,
2057,время доставка долгий указанный num случай num ассортимент сильно тот яндекс лавка
2058,свежий продукция
2059,овощ фрукт испортить доставлять
2060,бывать долгий доставка
2061,время доставка категорически соблюдаться оформление писаться num минута пофакт последний num месяц num доставить течение num минута тикж напрягать часто минимальный сумма заказ numnum р ты нужно пофакт пара позиция
2062,курьер смочь дозвониться заказ сразу отменяться указывать максимум информация вообще нужда звонить приходиться ждать снова
2063,удобно просто
2064,очень дорого
2065,долгий доставка писать num минута везти num
2066,ранний удобноnum заказать небольшой количество продуктовсейчас приходиться заказывать ненужный продукт войти минсумма заказ numnum рубль такой случай лёгкий заказать яндекс лавка num время доставка ранний быстрый итдлимит
2067,быстрый доставкаочень крутовёс нравиться
2068,плохо
2069,очень долго доставляться падла этакий
2070,доставка долгий ранний numминута num хотя ехать особо далеко написать поддержка тг бот ответить зовт оператор пришлый
2071,часто провозить просрочка
2072,пидорас опаздпать
2073,постоянный задержка постоянный оправдание поддержка рекомендовать быстрый доставка выполнять свой рекламный слоган мочь выполнить свой условие нужно кричать каждый утюг доставка num минута
2074,супер
2075,целое менее пойти доставка очень часто задерживаться очень некомфортно хотеться разнообразный ассортимент касаемо готовый еда качество хотеться улучшить размер порция
2076,декларировать num минута факт пойти num курьер передать
2077,удобно платить чаевой включить общий чек сделать опция оставлять заказ дверь добавить баранка мак печение ваш производство очень спасибо становиться орех плесень червь давно спасибо
2078,л
2079,удобно слишком дорого долго
2080,думать
2081,пидор
2082,качественный персонал время опаздывать приложение работать плохой режим дозваниваютсянадо работать качествомпродукт продаваться магазин
2083,клиентоориентированность скатиться просто ноль
2084,писать доставка num мина факт долгий
2085,ранний доставка мгновенный бывать numnum минута
2086,зачёт
2087,вместо полчаса заказ везти час
2088,очень долго
2089,хо ро что
2090,приложение работать плохо постоянно тормозить зависать скудный ассортимент
2091,num минута ждм заказ num напиток мороженое раздел доставка num минута поддержка завтрак кормить
2092,ранний готовый еда вкусный измениться плохой сторона доставка вечный проблема задерживать
2093,курьер просто пиздос
2094,ненавидеть приходиться ждать вместо num минута час ещ никто извиняться
2095,хороший
2096,долгий доставка ранний скидка давать задержка
2097,хотеться получать продукт свежий истекший срок годность самый мочь сказать фруктаховощ
2098,сравнивать лавка быстрый доставка качественный продукт бывало такой заказ собрать правильно чтоть доложить вовсе тд самокат расти расти
2099,стать гораздо редкий заказывать продукт ваш основный преимущество num минута испариться поддержка отписываться хватать курьер также num минута это минимальный время нужно какойтый договор сайт заглянуть
2100,доставка задержаться качество еда особенно порезка овощ салат улучшить
2101,долго доставлять часто задержка
2102,привозить свежий хлеб поддержка вообще связаться
2103,вернуть деньга
2104,красный рыбка хотеться дорого
2105,срань
2106,очень часто доставка занимать около час хотя позиционироваться самый быстрый яндекс лавка гораздо быстрый доставлять товар тот цена часто ниже
2107,очень маленький ассортимент
2108,норма
2109,слишком долго собираться заказ
2110,дорого
2111,привозить время
2112,изначально круто качество начало падать
2113,очень нравиться быстрый доставка
2114,подряд курьер задерживаться прошлый опоздать час
2115,очень дорого
2116,слишком высокий цена минимальный сумма заказ хотеться скидка
2117,постоянно очень долгий доставка бывать ждать numnum минута это огорчать ранний доставлять менее num минута
2118,удобный сервис немного завысить цена случай перегрузка поддержка вообще отвечать часто привозить продукт очень хороший качествагнилой овощ фрукт мятый продукт
2119,качество фрукт хороший
2120,последний заказ доставлять час курьер перепутать адрес потратить куча время выяснение
2121,год лето заказ доставлять num мина это оч быстро долгий хотеться ассортимент большой
2122,
2123,ассортимент оставлять делать хороший доставка заказ приложение написать курьер вотвота итог стоить ждать мина num вместо заниматься работа
2124,очень долгий доставка постоянно задерживаться
2125,очень довольный платформа часто бывать перегруз очень хотеться свой заказ раз указать
2126,думать очень долгий стать вместо num минута бывать ждать num яндекс гораздо быстрый
2127,мороженный испортиться цена расти
2128,дороговатый очень маленький ассортимент оч мало товар который обычный магазин
2129,хреновый курьер
2130,вечный проблема доставка писать numnum минута факт два час невозможно отследить курьер
2131,работать
2132,нравиться сделать сумма минимальный заказ numр салат сделать доставка numр
2133,
2134,очень долгий доставка
2135,очень долгий доставка
2136,хороший доставка большой конкурент весь товар низкий цена прибавить население беднеть
2137,последний времяочень долгий доставка
2138,поддержка работать клиентоориентированный отвечать речевой модуль полномочие решить конкретный проблема
2139,ранний просто сметана заказать такой прикольно возить велосипед машина долго
2140,долго ждм доставка
2141,нормик
2142,плохо пройти оплата num минута написать заказ отменный вернуть деньга
2143,писать num минута привозить минута num час писать течение час
2144,хороший доставка
2145,прикольно везде доставлять многие место перестать доставлять
2146,писать num минута раз уложиться каждый извиняться
2147,низкий оптимизация приложение отсутствие компенсация долгий доставка вплоть закрыть ваш заявка обращение клиентоориентированность уровень бедный курьер возить гигантский сумка забитый завязка жалкий деньга
2148,доставка пол час курьер завершать заказ момент вручение вообще товар резко заканчиваться момент сборка заказ предлагать замена
2149,ассортимент желательно расширить
2150,дорого
2151,супер нужно срочно удобно непогода срок доставка постоянно задержка писать сразу увеличение время доставка
2152,доставка стать невыносимый долгий основный время составлять num минута очень часто доставлять плохой товар
2153,долго долго ждать
2154,медленный курьер дорогой товар
2155,устраивать срок годность продукт немного мятый продукт доставка
2156,заявить доставка num минута работать среднее numnum минута доставка
2157,нравиться привозить товар основное нормальный срок годность
2158,успеть взять трубка курьер уехать нос остановить удаться
2159,привозить старое поддержка отстой доставка долгий
2160,очень
2161,поддержка отвратительный шаблон скрипт тд доставка писать num минута факт numnum час
2162,нравиться постоянно меняться минимальный сумма заказ
2163,целое зачтный сложно набрать numр
2164,изначально суперпосле увеличиться время доставкизачастый курьер задерживаетсяхотя пишетчто вастак взгляд совершенно интуитивно непонятный интерфейсный это вкусовщинаползунок оставить дверь должный фиксироваться
2165,ужасный отношение доставка заказ мочь просто молча отменить оповестить заказчик ссылаться курьер якобы мочь дозвониться
2166,постоянно привозить молоко срок годность который скоро окончиться жалоба помогать бесить момент
2167,привезти неспелый авокадо заказать сразу сделать салат прийтись ждать видимо пара день
2168,хороший выбор очень нравиться коллаборация кухня район зачастую расстраивать срок доставка изначально показывать num минута курьер уложиться срок лишь вести час полтора
2169,постоянно опаздывать курьер проследить это пожалуйста
2170,привозить товар исткнуть срок годность
2171,сабай быстрый доставка поддержка отвратительный
2172,доставка улучшитьбыть отлично
2173,часто привозить просрочить испортить продукт
2174,часто опаздывать курьер рассчитывать заказ мочь убрать чтоть заказ позвонить предложить замена
2175,обычный советский сервис хотеться дух время курьер следить опрятность ассортимент заняться
2176,вечный проблема курьер
2177,очень медленно работать кофе
2178,удалённый адрес срок доставка равный доставка сбермаркет numnumминута
2179,очень долго доставлять
2180,збс
2181,
2182,жить
2183,цена намного выше магазин служба поддержка долго отвечать решать мало акция цена действительно хороший завысить раз тип скидка num выходить итог дорогой близкий магнит пятёрочка
2184,
2185,очень испортиться доставка время который срок опаздание пол час
2186,последний время очень долгий доставка товар хотеться быстрый заявить приложение
2187,безответственный работа курьер поддержка заказывать быть
2188,нравиться увеличиться время доставка
2189,минимальный сумма заказ стать слишком большой вечерний время нагрузка курьер ставить цена num рубль
2190,куриный сосиска просто отвратительный свой деньга стоять скидка подменить дешманский ужасный вкус помойка мочь приехать забрать обратно деньга вернуть баланс карта
2191,очень нравиться заказать самокат раз попадать несвежий продукт ранний весь советовать помалкивать несвежий продукт проскальзывать перепроверять срок внешний вид продукт
2192,сложный сайт
2193,норма num нужный доставка
2194,цена высокий долго везти срок годность продукт проверять
2195,оооочень долго доставлять заказ проверить спелый авокадо оказываться абсолютно зрелый качество готовый еда сильно ухудшиться цена вырасти numnum раз
2196,понимание точный время доставка обычный ситуация писать курьер вотвота это означать ждать num минута
2197,цена задрать некоторый позиция рис увёлка numр капец курьер долго освобождаться остальной спасибо
2198,хороший организация доставка продукт домой мелочь портить впечатление
2199,стучать приехать адрес отменять
2200,очень часто бывать умирающий продукт связь фрукт овощ заказывать
2201,хотеться иметь возможность оставлять отзыв товар избежание нерациональный покупка
2202,курьер опаздывать
2203,курьер путь час хотя обещать num минута
2204,шея
2205,ранний
2206,часто выбирать другой доставка быстрый самокат выбирать нужный товар хотеть заказать чтоть производство самокат
2207,сервис позиционироваться магазин дом доставка течение num минута сумма заказ доступный момент заказ меняться течение num минута сервис испортиться
2208,часто тухляк
2209,тупой скачка сумма доставка
2210,минута минимальный стоимость заказ варьироваться num numр свой ум отменять заказ оплатить вспоминать чтоть корзина отсутствовать хромать ваш служба
2211,цена выше конкурент яндекс лавка поэтому заказывать редко
2212,очень удобный собирать заказ очень долго
2213,очень нравиться мороженое самокат
2214,добавить отзыв продуктыхотя разрез рейтинг num num
2215,долгий доставка проблема курьер неудобный оплата
2216,очень долгий доставка
2217,
2218,нравиться быстрый доставка цена очень кусачий
2219,ребята нежно любить часто заказывать умолять прекратить писать доставка полчаса это сразу писать час курьер мало заказ понятно справляться хотя обидно
2220,козинак настоящий кола
2221,целое очень удобно очень часто установить минимальный сумма заказ заставлять отказаться услуга самокат
2222,брать трубка сбрасывать курьер приезжать назначить воемить
2223,ужасно долгий доставка
2224,устать ждать часто очень долгий ожидание
